{
  "artifact_type": "implementation_blueprint",
  "schema_version": "1.0.0",
  "artifact_id": "HP-BP-EXAMPLE-001",
  "artifact_digest": "sha256:1111111111111111111111111111111111111111111111111111111111111111",
  "project_id": "hive-plan",
  "increment_id": "HP-WO-EXAMPLE-001",
  "work_order_ref": {"artifact_id":"HP-WO-EXAMPLE-001","artifact_type":"work_order","artifact_digest":"sha256:2222222222222222222222222222222222222222222222222222222222222222"},
  "context_lock_ref": {"artifact_id":"HP-CL-EXAMPLE-001","artifact_type":"context_lock","artifact_digest":"sha256:3333333333333333333333333333333333333333333333333333333333333333"},
  "guidance_level": "G3",
  "objective": "Implement a bounded reconnect state machine without changing public contracts.",
  "scope": ["Reconnect state machine and deterministic tests"],
  "out_of_scope": ["Provider redesign"],
  "must_not_touch": ["billing/**"],
  "change_surface": {"must_touch":["apps/api/src/realtime/reconnect.ts"],"likely_touch":["apps/api/test/reconnect.test.ts"],"watch_only":["packages/contracts/**"]},
  "file_plan": [{"path":"apps/api/src/realtime/reconnect.ts","operation":"UPDATE","reason":"Implement frozen reconnect behavior"}],
  "symbol_plan": [{"symbol":"ReconnectController","expected_signature":null,"responsibility":"Own bounded reconnect state transitions"}],
  "data_flow": ["disconnect -> backoff -> reconnect -> watermark validation -> snapshot if gap cannot be proven complete"],
  "algorithm_plan": ["Use bounded exponential backoff with jitter and reject stale watermarks."],
  "contracts": ["Critical events are never silently dropped."],
  "error_handling": ["Enter degraded state when reconnect budget is exhausted."],
  "edge_cases": ["Connection drops during snapshot recovery."],
  "failure_shield": ["Do not treat reconnect success as proof of event-gap completeness."],
  "test_plan": ["Unit test reconnect transitions and stale watermark rejection."],
  "evidence_plan": ["Exact-head test receipt and changed-file list."],
  "observability": ["Emit reconnect attempt and recovery outcome events."],
  "performance_budgets": ["Reconnect logic must not block the event loop."],
  "decision_budget": [{"class":"FROZEN","statement":"Use bounded exponential backoff with jitter.","criterion":null},{"class":"ESCALATE","statement":"Public event contract must change.","criterion":"Stop and request blueprint/work-order recompilation."}],
  "implementation_sequence": ["Verify locked sources", "Implement controller", "Add tests", "Run evidence commands"],
  "stop_condition": "All required tests pass at exact head or execution is truthfully BLOCKED.",
  "created_at": "2026-09-11T19:16:00Z",
  "producer": {"kind":"hive-plan-agent","name":"Implementation Blueprint Compiler","version":"proposal-v1"}
}